sentence,relation,entities,sentence_no_tags
"The <e1>drugs</e1> he sold had caused the overdose <e2>death</e2> of Matthew Lessard, 19, of Lowell.",0,"['drugs', 'death']","The drugs he sold had caused the overdose death of Matthew Lessard, 19, of Lowell."
The <e1>jar</e1> from the fall had caused a subdural <e2>hematoma</e2> on the right front side of my brain that shows up in the CT.,0,"['jar', 'hematoma']",The jar from the fall had caused a subdural hematoma on the right front side of my brain that shows up in the CT.
<e1>Earthquakes</e1> are caused by the <e2>discharge</e2> of accumulated along geologic faults.,1,"['Earthquakes', 'discharge']",Earthquakes are caused by the discharge of accumulated along geologic faults.
<e1>Oscillation</e1> of the lever caused by the <e2>swinging</e2> of the pendulum.,1,"['Oscillation', 'swinging']",Oscillation of the lever caused by the swinging of the pendulum.
"Method according to claim 1, characterized in that the time duration of the quality reduction is limited at least to the duration of the <e1>interference</e1> triggered by the switching <e2>process</e2>.",1,"['interference', 'process']","Method according to claim 1, characterized in that the time duration of the quality reduction is limited at least to the duration of the interference triggered by the switching process."
Student <e1>protests</e1> are turning into a Twitter <e2>revolution</e2> in Moldova.,0,"['protests', 'revolution']",Student protests are turning into a Twitter revolution in Moldova.
"Nasal <e1>dryness</e1> causes nosebleeds, <e2>coughing</e2>, wheezing, and other short-term respiratory problems.",0,"['dryness', 'coughing']","Nasal dryness causes nosebleeds, coughing, wheezing, and other short-term respiratory problems."
"Colds and <e1>flu</e1> cause <e2>inflammation</e2> of the mucous membranes of the nose, throat and mouth.",0,"['flu', 'inflammation']","Colds and flu cause inflammation of the mucous membranes of the nose, throat and mouth."
Defra identified the different <e1>noises</e1> made by <e2>dogs</e2> and the meanings behind them.,0,"['noises', 'dogs']",Defra identified the different noises made by dogs and the meanings behind them.
The Maryland Department of the Environment has already worked to reduce the amount of <e1>pollution</e1> from sources like cars and <e2>factories</e2>.,1,"['pollution', 'factories']",The Maryland Department of the Environment has already worked to reduce the amount of pollution from sources like cars and factories.
"<e1>Soya farming</e1> is one of the main causes of tropical <e2>deforestation</e2>, which currently produces a fifth of global climate change.",0,"['Soya farming', 'deforestation']","Soya farming is one of the main causes of tropical deforestation, which currently produces a fifth of global climate change."
The encroaching <e1>darkness</e1> has been caused by the twin horrors of war and a mysterious <e2>plague</e2>.,1,"['darkness', 'plague']",The encroaching darkness has been caused by the twin horrors of war and a mysterious plague.
"Alzheimer's disease is a degenerative brain <e1>disorder</e1> that results in <e2>memory loss</e2>, impaired thinking, difficulty finding the right word when speaking, and personality changes (see ""Warning signs of Alzheimer's disease,"" below).",0,"['disorder', 'memory loss']","Alzheimer's disease is a degenerative brain disorder that results in memory loss, impaired thinking, difficulty finding the right word when speaking, and personality changes (see ""Warning signs of Alzheimer's disease,"" below)."
The clock <e1>signal</e1> was generated from an external cavity semiconductor <e2>laser</e2>.,1,"['signal', 'laser']",The clock signal was generated from an external cavity semiconductor laser.
The <e1>landslides</e1> caused by these earthquakes and <e2>aftershocks</e2> were concentrated along the mudstone and sandstone surfaces.,1,"['landslides', 'aftershocks']",The landslides caused by these earthquakes and aftershocks were concentrated along the mudstone and sandstone surfaces.
The desperate <e1>man</e1> who had clung to the stump had battered the rocks with a shuddering <e2>thump</e2>.,0,"['man', 'thump']",The desperate man who had clung to the stump had battered the rocks with a shuddering thump.
"Systemically, dust and <e1>fume</e1> cause irritation of the upper respiratory tract, metallic taste and <e2>nausea</e2>.",0,"['fume', 'nausea']","Systemically, dust and fume cause irritation of the upper respiratory tract, metallic taste and nausea."
"The <e1>dust</e1>, noise, and sleep deprivation produced by the <e2>construction</e2> are intolerable.",1,"['dust', 'construction']","The dust, noise, and sleep deprivation produced by the construction are intolerable."
The <e1>transmitter</e1> sends a radio <e2>signal</e2> to the doorbell radio receiver inside the building.,0,"['transmitter', 'signal']",The transmitter sends a radio signal to the doorbell radio receiver inside the building.
They are all in on it and the same <e1>people</e1> who caused the <e2>destruction</e2> of the economy are still running the show so they can keep us down and buy up the country cheap.,0,"['people', 'destruction']",They are all in on it and the same people who caused the destruction of the economy are still running the show so they can keep us down and buy up the country cheap.
"In two of the cases reported in the media, an older woman's baby was stillborn because of an abnormal placeta, and one of the <e1>miscarriages</e1> was caused by the umbilical <e2>chord</e2> encircling the fetus.",1,"['miscarriages', 'chord']","In two of the cases reported in the media, an older woman's baby was stillborn because of an abnormal placeta, and one of the miscarriages was caused by the umbilical chord encircling the fetus."
"When it was closer she saw the <e1>light</e1> was coming from a <e2>flashlight</e2> being carried in the mouth of a large black Scottie dog, its muzzle gray with age.",1,"['light', 'flashlight']","When it was closer she saw the light was coming from a flashlight being carried in the mouth of a large black Scottie dog, its muzzle gray with age."
<e1>Vulvodynia</e1> is the cause of chronic <e2>vulval pain</e2> in the absence of skin disease and infection.,0,"['Vulvodynia', 'vulval pain']",Vulvodynia is the cause of chronic vulval pain in the absence of skin disease and infection.
Olympic chiefs are worried about the environmental <e1>damage</e1> caused by the Olympic <e2>flame</e2>.,1,"['damage', 'flame']",Olympic chiefs are worried about the environmental damage caused by the Olympic flame.
"The log truck caught <e1>fire</e1> after the <e2>collision</e2>, but the 35-year-old driver escaped before the cab became engulfed in flames.",1,"['fire', 'collision']","The log truck caught fire after the collision, but the 35-year-old driver escaped before the cab became engulfed in flames."
"I have an additional concern about body exposure to any electromagnetic <e1>radiation</e1>, from <e2>computers</e2> and cell phones held next to the body.",1,"['radiation', 'computers']","I have an additional concern about body exposure to any electromagnetic radiation, from computers and cell phones held next to the body."
"The <e1>spill</e1> was caused by a <e2>leak</e2> in a Kuwaiti tanker carrying 160,000 tonnes of crude, after it collided with a dredger further south on December 14.",1,"['spill', 'leak']","The spill was caused by a leak in a Kuwaiti tanker carrying 160,000 tonnes of crude, after it collided with a dredger further south on December 14."
"Josie Cormier, succumbed to peer pressure and now hangs out with the popular <e1>crowd</e1> that often instigates the <e2>harassment</e2>.",0,"['crowd', 'harassment']","Josie Cormier, succumbed to peer pressure and now hangs out with the popular crowd that often instigates the harassment."
"Her unexpected <e1>elimination</e1> caused a <e2>riot</e2> on the Internet, and one blog site (SOHH.com) referred to her elimination episode as the one where the show lost all credibility.",0,"['elimination', 'riot']","Her unexpected elimination caused a riot on the Internet, and one blog site (SOHH.com) referred to her elimination episode as the one where the show lost all credibility."
"I changed the balance of the flavours through my selection of bread, and got an <e1>increase</e1> in the sweetness with a choice of <e2>raisin bread</e2>.",1,"['increase', 'raisin bread']","I changed the balance of the flavours through my selection of bread, and got an increase in the sweetness with a choice of raisin bread."
Our <e1>inquiry</e1> into the city's job creation funding came from a reader's <e2>tip</e2>.,1,"['inquiry', 'tip']",Our inquiry into the city's job creation funding came from a reader's tip.
It is very natural and normal to feel grief and <e1>sorrow</e1> after the <e2>loss</e2> of a pet.,1,"['sorrow', 'loss']",It is very natural and normal to feel grief and sorrow after the loss of a pet.
The <e1>irritation</e1> from the <e2>chemicals</e2> in the tobacco is considered to be the number one contributing factor.,1,"['irritation', 'chemicals']",The irritation from the chemicals in the tobacco is considered to be the number one contributing factor.
"The <e1>smell</e1> was radiating from all directions, from every <e2>tree</e2> and branch.",1,"['smell', 'tree']","The smell was radiating from all directions, from every tree and branch."
Thousands of women suffer <e1>headaches</e1> from <e2>caffeine withdrawal</e2> as a result of this study.,1,"['headaches', 'caffeine withdrawal']",Thousands of women suffer headaches from caffeine withdrawal as a result of this study.
Up to 85% of <e1>viruses</e1> that cause respiratory <e2>illness</e2> are identified by the technology.,0,"['viruses', 'illness']",Up to 85% of viruses that cause respiratory illness are identified by the technology.
The <e1>disruption</e1> has been caused by the freak storms and flash <e2>floods</e2> overnight.,1,"['disruption', 'floods']",The disruption has been caused by the freak storms and flash floods overnight.
An organization with the mission of allowing a safe haven for parents to share their <e1>grief</e1> after the <e2>death</e2> of a child.,1,"['grief', 'death']",An organization with the mission of allowing a safe haven for parents to share their grief after the death of a child.
I have been talking extensively here about the <e1>disruption</e1> that has been caused by the Brazilian Air Traffic Controllers white <e2>strike</e2>.,1,"['disruption', 'strike']",I have been talking extensively here about the disruption that has been caused by the Brazilian Air Traffic Controllers white strike.
Air <e1>pollution</e1> from <e2>coal</e2> fired sources is so serious we can not afford a policy that backslides in any way.,1,"['pollution', 'coal']",Air pollution from coal fired sources is so serious we can not afford a policy that backslides in any way.
Many viral <e1>infections</e1> that cause <e2>rash</e2> resolve within several days and require no medication.,0,"['infections', 'rash']",Many viral infections that cause rash resolve within several days and require no medication.
The kind of treatments necessary to kill the <e1>bacteria</e1> which cause acne <e2>breakouts</e2> must be prescribed or administered by a medical professional.,0,"['bacteria', 'breakouts']",The kind of treatments necessary to kill the bacteria which cause acne breakouts must be prescribed or administered by a medical professional.
"<e1>Blinking</e1> is caused by the <e2>eyelids</e2> sliding down over the positively charged cornea, whereas saccade potentials are caused by changes in the orientation of the corneoretinal dipole.",1,"['Blinking', 'eyelids']","Blinking is caused by the eyelids sliding down over the positively charged cornea, whereas saccade potentials are caused by changes in the orientation of the corneoretinal dipole."
The surprise <e1>visit</e1> caused a <e2>frenzy</e2> on the already chaotic trading floor.,0,"['visit', 'frenzy']",The surprise visit caused a frenzy on the already chaotic trading floor.
An agenda of deeper reforms can boost public confidence even as it undoes a lot of the <e1>distress</e1> caused by the financiers and <e2>bankers</e2>.,1,"['distress', 'bankers']",An agenda of deeper reforms can boost public confidence even as it undoes a lot of the distress caused by the financiers and bankers.
Be sure to drink plenty of water to prevent running a <e1>fever</e1> from <e2>dehydration</e2>.,1,"['fever', 'dehydration']",Be sure to drink plenty of water to prevent running a fever from dehydration.
"The consequences of the <e1>injuries</e1> caused by the <e2>bike-accident</e2> in February, fractures in the area of head and neck, unfortunately have turned out to be still too severe.",1,"['injuries', 'bike-accident']","The consequences of the injuries caused by the bike-accident in February, fractures in the area of head and neck, unfortunately have turned out to be still too severe."
"The amide-linked local <e1>anesthetics</e1>, bupivacaine and ropivacaine, cause <e2>depression</e2> of cardiac contractility and dysrhythmias.",0,"['anesthetics', 'depression']","The amide-linked local anesthetics, bupivacaine and ropivacaine, cause depression of cardiac contractility and dysrhythmias."
"Aware of the <e1>suffering</e1> caused by unmindful <e2>drinking</e2>, I am committed to cultivate good health, both physical and mental, for myself, my family, and my society.",1,"['suffering', 'drinking']","Aware of the suffering caused by unmindful drinking, I am committed to cultivate good health, both physical and mental, for myself, my family, and my society."
Oak root and chamomile provide a gentle astringent that helps reduce inflammation and calms skin <e1>irritation</e1> from the <e2>sun</e2> and environmental pollutants.,1,"['irritation', 'sun']",Oak root and chamomile provide a gentle astringent that helps reduce inflammation and calms skin irritation from the sun and environmental pollutants.
The <e1>colitis</e1> usually is caused by taking <e2>antibiotics</e2>.,1,"['colitis', 'antibiotics']",The colitis usually is caused by taking antibiotics.
"The halting of easy <e1>profits</e1> from <e2>inflation</e2> brought on a banking crisis, which resulted in a complete restructuring of the industry during the late 1990s.",1,"['profits', 'inflation']","The halting of easy profits from inflation brought on a banking crisis, which resulted in a complete restructuring of the industry during the late 1990s."
"Overall, the <e1>fire</e1> after the <e2>earthquake</e2> burned out 7456 houses in over 530 localities.",1,"['fire', 'earthquake']","Overall, the fire after the earthquake burned out 7456 houses in over 530 localities."
The northwest <e1>swell</e1> was generated by a powerful <e2>storm</e2> off Japan on Jan. 5 and gained strength last week.,1,"['swell', 'storm']",The northwest swell was generated by a powerful storm off Japan on Jan. 5 and gained strength last week.
"In the same way that diet and <e1>stress</e1> effect facial <e2>acne</e2> they also effect body acne therefore the basic ""clear skin rules"" of cutting out greasy, fatty foods, and sugary foods as well as trying to reduce everyday stress apply to body acne as well.",0,"['stress', 'acne']","In the same way that diet and stress effect facial acne they also effect body acne therefore the basic ""clear skin rules"" of cutting out greasy, fatty foods, and sugary foods as well as trying to reduce everyday stress apply to body acne as well."
The <e1>wire</e1> had caused a slight <e2>injury</e2> on the ventral side of the neck and at the base of horns.,0,"['wire', 'injury']",The wire had caused a slight injury on the ventral side of the neck and at the base of horns.
Special articles specifically on gas corrosion and <e1>stress</e1> <e2>corrosion</e2> are also available in the literature.,0,"['stress', 'corrosion']",Special articles specifically on gas corrosion and stress corrosion are also available in the literature.
Recent traffic studies by the department show that a majority of the <e1>accidents</e1> are caused by <e2>drivers</e2>.,1,"['accidents', 'drivers']",Recent traffic studies by the department show that a majority of the accidents are caused by drivers.
Chest <e1>pain</e1> from <e2>indigestion</e2> feels like an intense burning and is usually accompanied by regurgitation and gas.,1,"['pain', 'indigestion']",Chest pain from indigestion feels like an intense burning and is usually accompanied by regurgitation and gas.
"It was intermittently wet and dry, and almost always followed with a whine and often a few <e1>tears</e1> from the terrible <e2>pain</e2>.",1,"['tears', 'pain']","It was intermittently wet and dry, and almost always followed with a whine and often a few tears from the terrible pain."
"The mite's <e1>burrows</e1>, fecal matter, proteins and eggs cause itching, <e2>rashes</e2> and sensitivity.",0,"['burrows', 'rashes']","The mite's burrows, fecal matter, proteins and eggs cause itching, rashes and sensitivity."
"Thus previous scientific estimates had overstated the <e1>devastation</e1> caused by the <e2>asteroid</e2>, since topographic and ecologic factors contributing to the result had not been taken into account.",1,"['devastation', 'asteroid']","Thus previous scientific estimates had overstated the devastation caused by the asteroid, since topographic and ecologic factors contributing to the result had not been taken into account."
The analysis <e1>device</e1> instigates the <e2>termination</e2> of the connection.,0,"['device', 'termination']",The analysis device instigates the termination of the connection.
Either we saw our mothers show <e1>fear</e1> from <e2>bugs</e2> /spiders/cockroaches and learned to fear them irrationally.,1,"['fear', 'bugs']",Either we saw our mothers show fear from bugs /spiders/cockroaches and learned to fear them irrationally.
"It's common to get a slight <e1>fever</e1> from <e2>immunizations</e2>, which can make them uncomfortable.",1,"['fever', 'immunizations']","It's common to get a slight fever from immunizations, which can make them uncomfortable."
They are intentionally sewn larger than the pillow to accommodate for <e1>shrinkage</e1> from <e2>washing</e2>.,1,"['shrinkage', 'washing']",They are intentionally sewn larger than the pillow to accommodate for shrinkage from washing.
Heavy <e1>thunderstorms</e1> caused <e2>cancellation</e2> of races later in the afternoon preventing the Masters Mens fours and Masters Womens and Womens eights from racing.,0,"['thunderstorms', 'cancellation']",Heavy thunderstorms caused cancellation of races later in the afternoon preventing the Masters Mens fours and Masters Womens and Womens eights from racing.
"Actually, the earthquake is largely from a global company that had interests insured in China, whereas the <e1>snowstorm</e1> <e2>losses</e2> are exclusively from a variety of Chinese companies that we had relationships with for some year.",0,"['snowstorm', 'losses']","Actually, the earthquake is largely from a global company that had interests insured in China, whereas the snowstorm losses are exclusively from a variety of Chinese companies that we had relationships with for some year."
By avoiding or limiting contact with trash the chance of contracting <e1>germs</e1> that lead to <e2>sickness</e2> or disease is decreased.,0,"['germs', 'sickness']",By avoiding or limiting contact with trash the chance of contracting germs that lead to sickness or disease is decreased.
"In the years since the ADM scandal of the 1990s, the <e1>calamities</e1> caused by the <e2>subversion</e2> of the food resources of masses of people to the private profit interests of a few has reached new heights.",1,"['calamities', 'subversion']","In the years since the ADM scandal of the 1990s, the calamities caused by the subversion of the food resources of masses of people to the private profit interests of a few has reached new heights."
"The living <e1>vaccine</e1>, caused a sharp <e2>temperature elevation</e2> on the day following the second injection.",0,"['vaccine', 'temperature elevation']","The living vaccine, caused a sharp temperature elevation on the day following the second injection."
"In a person who already has some neck <e1>tension</e1> from <e2>stress</e2>, such an event can lead to a long-term increase of neck tension.",1,"['tension', 'stress']","In a person who already has some neck tension from stress, such an event can lead to a long-term increase of neck tension."
The first order of business when a patient complains of palpitations is to check whether the <e1>palpitations</e1> are caused by a <e2>heart rhythm</e2>.,1,"['palpitations', 'heart rhythm']",The first order of business when a patient complains of palpitations is to check whether the palpitations are caused by a heart rhythm.
"The <e1>miscarriages</e1> are caused by one time, non-repeating <e2>genetic problems</e2>.",1,"['miscarriages', 'genetic problems']","The miscarriages are caused by one time, non-repeating genetic problems."
"It found the net aggregate economic benefit to native-born Americans from the enormous <e1>influx</e1> accidentally triggered by the 1965 <e2>immigration</e2> is nugatory-less than $10 billion a year, in an economy of $10 trillion.",1,"['influx', 'immigration']","It found the net aggregate economic benefit to native-born Americans from the enormous influx accidentally triggered by the 1965 immigration is nugatory-less than $10 billion a year, in an economy of $10 trillion."
McGee's <e1>talent</e1> stemmed from mother's <e2>teaching</e2>.,1,"['talent', 'teaching']",McGee's talent stemmed from mother's teaching.
Harbor Beach man pleads in <e1>case</e1> that stemmed from dog <e2>attack</e2> on tot.,1,"['case', 'attack']",Harbor Beach man pleads in case that stemmed from dog attack on tot.
<e1>Sinusitis</e1> and tinnitus cause stress or <e2>anxiety</e2>.,0,"['Sinusitis', 'anxiety']",Sinusitis and tinnitus cause stress or anxiety.
"The cool <e1>fog</e1> of the summer morning had inundated the fabric of the blimp's coverings with excess <e2>moisture</e2>, adding additional weight to the aircraft.",0,"['fog', 'moisture']","The cool fog of the summer morning had inundated the fabric of the blimp's coverings with excess moisture, adding additional weight to the aircraft."
The <e1>perturbations</e1> caused by the substorm related field-aligned <e2>currents</e2> are most notable in the east-west deflections of the geosynchronous magnetic field.,1,"['perturbations', 'currents']",The perturbations caused by the substorm related field-aligned currents are most notable in the east-west deflections of the geosynchronous magnetic field.
Xanax works by changing brain <e1>chemicals</e1> that cause stress and <e2>anxiety</e2>.,0,"['chemicals', 'anxiety']",Xanax works by changing brain chemicals that cause stress and anxiety.
"However several species of <e1>fungi</e1>, insect, and bacteria cause <e2>mortality</e2> or reduced growth of the tree.",0,"['fungi', 'mortality']","However several species of fungi, insect, and bacteria cause mortality or reduced growth of the tree."
The author clearly got a great deal of <e1>pleasure</e1> from the <e2>work</e2> and did not allow his vast amount of material to force him into shallow generalizations.,1,"['pleasure', 'work']",The author clearly got a great deal of pleasure from the work and did not allow his vast amount of material to force him into shallow generalizations.
"General information about the <e1>infection</e1> caused by the <e2>bacteria</e2> called Salmonella, when food is eaten raw or undercooked.",1,"['infection', 'bacteria']","General information about the infection caused by the bacteria called Salmonella, when food is eaten raw or undercooked."
"All the <e1>profits</e1> from the <e2>books</e2> listed below are donated to the Norman Historic Preservation Program, Inc. (NHPP) to be used toward the renovation of the old Norman High School as a children's educational center and museum.",1,"['profits', 'books']","All the profits from the books listed below are donated to the Norman Historic Preservation Program, Inc. (NHPP) to be used toward the renovation of the old Norman High School as a children's educational center and museum."
Gaza following the widespread <e1>destruction</e1> caused by the Israeli <e2>invasion</e2>.,1,"['destruction', 'invasion']",Gaza following the widespread destruction caused by the Israeli invasion.
The <e1>hole</e1> has been caused by the <e2>accumulation</e2> of dust into planets like Earth.,1,"['hole', 'accumulation']",The hole has been caused by the accumulation of dust into planets like Earth.
Sigmoid colon <e1>diverticulitis</e1> is the most common cause of acute <e2>pain</e2> in the left lower abdomen in older adults.,0,"['diverticulitis', 'pain']",Sigmoid colon diverticulitis is the most common cause of acute pain in the left lower abdomen in older adults.
"The relative <e1>calm</e1> produced by the Shia <e2>ceasefire</e2> has coincided with what the CIA is now calling the ""near strategic defeat"" of al-Qaeda in Iraq.",0,"['calm', 'ceasefire']","The relative calm produced by the Shia ceasefire has coincided with what the CIA is now calling the ""near strategic defeat"" of al-Qaeda in Iraq."
"We are aware that <e1>acne</e1> or pimples are caused by <e2>hormonal imbalance</e2>, improper skin care or bad eating habits.",1,"['acne', 'hormonal imbalance']","We are aware that acne or pimples are caused by hormonal imbalance, improper skin care or bad eating habits."
My grandmother is beautiful too but she has a lot of <e1>wrinkles</e1> from the <e2>sun</e2>.,1,"['wrinkles', 'sun']",My grandmother is beautiful too but she has a lot of wrinkles from the sun.
