sentence,relation,entities,sentence_no_tags
The current view is that the chronic <e1>inflammation</e1> in the distal part of the stomach caused by Helicobacter pylori <e2>infection</e2> results in an increased acid production from the non-infected upper corpus region of the stomach.,1,"['inflammation', 'infection']",The current view is that the chronic inflammation in the distal part of the stomach caused by Helicobacter pylori infection results in an increased acid production from the non-infected upper corpus region of the stomach.
The <e1>burst</e1> has been caused by water hammer <e2>pressure</e2>.,1,"['burst', 'pressure']",The burst has been caused by water hammer pressure.
"The <e1>singer</e1>, who performed three of the nominated songs, also caused a <e2>commotion</e2> on the red carpet.",0,"['singer', 'commotion']","The singer, who performed three of the nominated songs, also caused a commotion on the red carpet."
"<e1>Suicide</e1> is one of the leading causes of <e2>death</e2> among pre-adolescents and teens, and victims of bullying are at an increased risk for committing suicide.",0,"['Suicide', 'death']","Suicide is one of the leading causes of death among pre-adolescents and teens, and victims of bullying are at an increased risk for committing suicide."
He had chest pains and <e1>headaches</e1> from <e2>mold</e2> in the bedrooms.,1,"['headaches', 'mold']",He had chest pains and headaches from mold in the bedrooms.
Financial <e1>stress</e1> is one of the main causes of <e2>divorce</e2>.,0,"['stress', 'divorce']",Financial stress is one of the main causes of divorce.
The <e1>women</e1> that caused the <e2>accident</e2> was on the cell phone and ran thru the intersection without pausing on the median.,0,"['women', 'accident']",The women that caused the accident was on the cell phone and ran thru the intersection without pausing on the median.
<e1>Calluses</e1> are caused by improperly fitting shoes or by a <e2>skin abnormality</e2>.,1,"['Calluses', 'skin abnormality']",Calluses are caused by improperly fitting shoes or by a skin abnormality.
"As in the popular movie ""Deep Impact"", the action of the Perseid <e1>meteor shower</e1> is caused by a <e2>comet</e2>, in this case periodic comet Swift-Tuttle.",1,"['meteor shower', 'comet']","As in the popular movie ""Deep Impact"", the action of the Perseid meteor shower is caused by a comet, in this case periodic comet Swift-Tuttle."
The <e1>radiation</e1> from the atomic <e2>bomb explosion</e2> is a typical acute radiation.,1,"['radiation', 'bomb explosion']",The radiation from the atomic bomb explosion is a typical acute radiation.
A neoplastic <e1>recurrence</e1> arose from an extensive <e2>radiation</e2> induced ulceration.,1,"['recurrence', 'radiation']",A neoplastic recurrence arose from an extensive radiation induced ulceration.
He has a tattoo on his right arm and <e1>scars</e1> from <e2>stitches</e2> on his right elbow.,1,"['scars', 'stitches']",He has a tattoo on his right arm and scars from stitches on his right elbow.
The continuing Nigerian <e1>outbreak</e1> is the biggest ever caused by the <e2>vaccine</e2>.,1,"['outbreak', 'vaccine']",The continuing Nigerian outbreak is the biggest ever caused by the vaccine.
The <e1>fire</e1> inside WTC was caused by exploding <e2>fuel</e2>.,1,"['fire', 'fuel']",The fire inside WTC was caused by exploding fuel.
The <e1>suffering</e1> caused by the <e2>terrorists</e2> is the real torture.,1,"['suffering', 'terrorists']",The suffering caused by the terrorists is the real torture.
"In a poetic twist, the <e1>tsunami</e1> triggered by the rock <e2>band</e2> forced many American jazz and blues singers to seek work in the United Kingdom, which is where Anderson found a receptive audience in 1965.",1,"['tsunami', 'band']","In a poetic twist, the tsunami triggered by the rock band forced many American jazz and blues singers to seek work in the United Kingdom, which is where Anderson found a receptive audience in 1965."
<e1>Leakage</e1> and fire caused due to <e2>corrosion</e2> of bypass piping for recirculation gas at a fuel oil desulphurization unit.,1,"['Leakage', 'corrosion']",Leakage and fire caused due to corrosion of bypass piping for recirculation gas at a fuel oil desulphurization unit.
The metal <e1>ball</e1> makes a ding ding ding <e2>noise</e2> when it swings back and hits the metal body of the lamp.,0,"['ball', 'noise']",The metal ball makes a ding ding ding noise when it swings back and hits the metal body of the lamp.
Historical view of the <e1>damage</e1> caused by the 1693 Catania <e2>earthquake</e2> and the reconstruction activities.,1,"['damage', 'earthquake']",Historical view of the damage caused by the 1693 Catania earthquake and the reconstruction activities.
"AI requested that the perpetrators be prosecuted to the fullest extent of the law, that adequate compensation be provided to the victims and that senior government and police officials offer apologies for the <e1>suffering</e1> caused by the responsible police <e2>officers</e2>.",1,"['suffering', 'officers']","AI requested that the perpetrators be prosecuted to the fullest extent of the law, that adequate compensation be provided to the victims and that senior government and police officials offer apologies for the suffering caused by the responsible police officers."
The Marshall Plan also provided a way of gaining public acceptance in Europe for the New Deal format that the United States had successfully used before the war to end the <e1>recession</e1> triggered by the 1929 Wall Street <e2>crash</e2>.,1,"['recession', 'crash']",The Marshall Plan also provided a way of gaining public acceptance in Europe for the New Deal format that the United States had successfully used before the war to end the recession triggered by the 1929 Wall Street crash.
"Once they grow there, the <e1>swelling</e1> and inflammation caused by the <e2>infection</e2> closes off the sac, causing it not to ""shed"" bacteria, and protecting the bacteria inside from antibiotics and your body's own immune cells.",1,"['swelling', 'infection']","Once they grow there, the swelling and inflammation caused by the infection closes off the sac, causing it not to ""shed"" bacteria, and protecting the bacteria inside from antibiotics and your body's own immune cells."
"Guitars are played acoustically; the <e1>tone</e1> is produced by the <e2>vibration</e2> of the strings which is amplified by the body of the guitar, which acts as a large hollow resonating chamber, or they may rely on an amplifier that can electronically manipulate tone.",1,"['tone', 'vibration']","Guitars are played acoustically; the tone is produced by the vibration of the strings which is amplified by the body of the guitar, which acts as a large hollow resonating chamber, or they may rely on an amplifier that can electronically manipulate tone."
"Arcane Subtlety reduced the threat caused by Polymorph by 40% at max rank, though the <e1>threat</e1> caused by the <e2>spell</e2> is minimal.",1,"['threat', 'spell']","Arcane Subtlety reduced the threat caused by Polymorph by 40% at max rank, though the threat caused by the spell is minimal."
"The beautiful hydrothermal features in the park (geysers, hot springs, mud pots, etc.), the uplift and subsidence, and many of the <e1>earthquakes</e1> are caused by the <e2>movements</e2> of hydrothermal and/or magmatic fluids.",1,"['earthquakes', 'movements']","The beautiful hydrothermal features in the park (geysers, hot springs, mud pots, etc.), the uplift and subsidence, and many of the earthquakes are caused by the movements of hydrothermal and/or magmatic fluids."
Forward <e1>motion</e1> of the vehicle through the air caused a <e2>suction</e2> on the road draft tube.,0,"['motion', 'suction']",Forward motion of the vehicle through the air caused a suction on the road draft tube.
"The <e1>malfunctions</e1> on Monday caused <e2>delays</e2> for patrons waiting to check out or renew books at the branches, and impeded access to personal accounts that allow users to renew or hold books online.",0,"['malfunctions', 'delays']","The malfunctions on Monday caused delays for patrons waiting to check out or renew books at the branches, and impeded access to personal accounts that allow users to renew or hold books online."
"Water <e1>damage</e1> from roof leaks, plumbing leaks or flooding lead to the <e2>growth</e2> of molds.",0,"['damage', 'growth']","Water damage from roof leaks, plumbing leaks or flooding lead to the growth of molds."
The <e1>discomfort</e1> from the <e2>injury</e2> was now precluding him from his occupation which involved prolonged procedures in the standing position.,1,"['discomfort', 'injury']",The discomfort from the injury was now precluding him from his occupation which involved prolonged procedures in the standing position.
"The <e1>water</e1> pushed to the coast resulted in <e2>tides</e2> as much as three feet above normal, with waves of 5-10 feet atop these tides.",0,"['water', 'tides']","The water pushed to the coast resulted in tides as much as three feet above normal, with waves of 5-10 feet atop these tides."
"The <e1>charge</e1> is the source of an electric <e2>field</e2>, which carries energy-the electrostatic self-energy.",0,"['charge', 'field']","The charge is the source of an electric field, which carries energy-the electrostatic self-energy."
The <e1>tardiness</e1> however has been caused by the <e2>arrival</e2> of my old man; who in true Bloodworth fashion has had me walking everywhere.,1,"['tardiness', 'arrival']",The tardiness however has been caused by the arrival of my old man; who in true Bloodworth fashion has had me walking everywhere.
The river had now turned into full <e1>flood</e1> after the <e2>deluge</e2> of rain a few days ago.,1,"['flood', 'deluge']",The river had now turned into full flood after the deluge of rain a few days ago.
She mentioned the <e1>scandal</e1> caused by a BBC <e2>documentary</e2> on the treatment of children in a special-needs home and asked how the state had responded to these.,1,"['scandal', 'documentary']",She mentioned the scandal caused by a BBC documentary on the treatment of children in a special-needs home and asked how the state had responded to these.
The World Health Organization(WHO) found that the <e1>radiation</e1> release from the Chernobyl <e2>accident</e2> was 200 times that of the Hiroshima and Nagasaki.,1,"['radiation', 'accident']",The World Health Organization(WHO) found that the radiation release from the Chernobyl accident was 200 times that of the Hiroshima and Nagasaki.
"Also, in the midst of the <e1>confusion</e1> caused by the <e2>coup</e2>, the issuing of militant posters was a way for artists and organizations to declare their active engagement against the rebellion.",1,"['confusion', 'coup']","Also, in the midst of the confusion caused by the coup, the issuing of militant posters was a way for artists and organizations to declare their active engagement against the rebellion."
The <e1>accident</e1> caused a major traffic <e2>snarl</e2> on the arterial road.,0,"['accident', 'snarl']",The accident caused a major traffic snarl on the arterial road.
"The various forms of idealistic, materialistic and agnostic philosophies are subject to the <e1>tension</e1> caused by the indicated <e2>situation</e2>.",1,"['tension', 'situation']","The various forms of idealistic, materialistic and agnostic philosophies are subject to the tension caused by the indicated situation."
<e1>Contractions</e1> of the diaphragm are caused by stimulation of the vagus nerve either by the brain or by <e2>irritation</e2> anywhere along the length of the nerve.,1,"['Contractions', 'irritation']",Contractions of the diaphragm are caused by stimulation of the vagus nerve either by the brain or by irritation anywhere along the length of the nerve.
Plantar <e1>warts</e1> are caused by a <e2>virus</e2> that infects the outer layer of skin on the soles of the feet.,1,"['warts', 'virus']",Plantar warts are caused by a virus that infects the outer layer of skin on the soles of the feet.
The stong <e1>earthquake</e1> caused a <e2>blackout</e2> on the sound stage and short-circuited some of the neon-tubed violins.,0,"['earthquake', 'blackout']",The stong earthquake caused a blackout on the sound stage and short-circuited some of the neon-tubed violins.
"Tension Release by Mega Food contains Sensoril, a clinically studied extract of a Ashwagandha that helps to inhibit fatigue and physical <e1>tension</e1> from everyday <e2>stress</e2>.",1,"['tension', 'stress']","Tension Release by Mega Food contains Sensoril, a clinically studied extract of a Ashwagandha that helps to inhibit fatigue and physical tension from everyday stress."
"<e1>Cardiovascular disease</e1> is one of the leading causes of <e2>morbidity</e2> and mortality in the UK, as well as in the developed and the developing world.",0,"['Cardiovascular disease', 'morbidity']","Cardiovascular disease is one of the leading causes of morbidity and mortality in the UK, as well as in the developed and the developing world."
<e1>Dizziness</e1> from nasal and <e2>sinus pressure</e2> usually can be seen on a good nasal examination and a CT of the sinuses.,1,"['Dizziness', 'sinus pressure']",Dizziness from nasal and sinus pressure usually can be seen on a good nasal examination and a CT of the sinuses.
This <e1>meeting</e1> establishes the <e2>laws</e2> which govern the church and the priorities for the coming year.,0,"['meeting', 'laws']",This meeting establishes the laws which govern the church and the priorities for the coming year.
"Phobia like <e1>fear</e1> from <e2>crowd</e2>, fear from insects, fear from height etc all contribute in developing the anxiety disorder.",1,"['fear', 'crowd']","Phobia like fear from crowd, fear from insects, fear from height etc all contribute in developing the anxiety disorder."
The hidden preamble or timing signal is employed to mark the time of commencement of the <e1>transmission</e1> of information pulses from a <e2>transmitter</e2>.,1,"['transmission', 'transmitter']",The hidden preamble or timing signal is employed to mark the time of commencement of the transmission of information pulses from a transmitter.
"Doe's <e1>confrontation</e1> with the flight attendant caused a <e2>commotion</e2> on the plane, prolonged the flight's delay, and added to the aggravation already being felt by the passengers and crew.",0,"['confrontation', 'commotion']","Doe's confrontation with the flight attendant caused a commotion on the plane, prolonged the flight's delay, and added to the aggravation already being felt by the passengers and crew."
"The increase of the signal might correspond to formation of the high-density excitons, while the <e1>reduction</e1> of the signal originates from the <e2>relaxation</e2>.",1,"['reduction', 'relaxation']","The increase of the signal might correspond to formation of the high-density excitons, while the reduction of the signal originates from the relaxation."
We estimate a wind speed associated with the <e1>devastation</e1> caused by the <e2>tornado</e2>.,1,"['devastation', 'tornado']",We estimate a wind speed associated with the devastation caused by the tornado.
"The basic <e1>indicator</e1> of the health <e2>condition</e2> of trees, stands and forests is tree defoliation.",1,"['indicator', 'condition']","The basic indicator of the health condition of trees, stands and forests is tree defoliation."
The <e1>deficits</e1> are caused by <e2>people</e2> saving too much of their money.,1,"['deficits', 'people']",The deficits are caused by people saving too much of their money.
"Heat, <e1>wind</e1> and smoke cause flight <e2>delays</e2>.",0,"['wind', 'delays']","Heat, wind and smoke cause flight delays."
"In developing countries four-fifths of all the <e1>illnesses</e1> are caused by water-borne <e2>diseases</e2>, with diarrhoea being the leading cause of childhood death.",1,"['illnesses', 'diseases']","In developing countries four-fifths of all the illnesses are caused by water-borne diseases, with diarrhoea being the leading cause of childhood death."
The <e1>destruction</e1> caused by the <e2>bombing</e2> of Attorney General Palmer's home.,1,"['destruction', 'bombing']",The destruction caused by the bombing of Attorney General Palmer's home.
The second biggest factor affecting the <e1>sound</e1> produced by a <e2>drum</e2> is the tension at which the drum head is held against the shell of the drum.,1,"['sound', 'drum']",The second biggest factor affecting the sound produced by a drum is the tension at which the drum head is held against the shell of the drum.
The largest <e1>landslide</e1> triggered by the <e2>earthquake</e2> is located approximately 32 kilometers southeast of Muzafarrabad in a tributary valley of the Jhelum River.,1,"['landslide', 'earthquake']",The largest landslide triggered by the earthquake is located approximately 32 kilometers southeast of Muzafarrabad in a tributary valley of the Jhelum River.
"The <e1>debris</e1> caused a <e2>crash</e2> on the Schuylkill, and it has been closed for hours because of the mishap.",0,"['debris', 'crash']","The debris caused a crash on the Schuylkill, and it has been closed for hours because of the mishap."
"A <e1>fire</e1> triggered by the <e2>blasts</e2> damaged eight buildings at the plant, including one that was burned down.",1,"['fire', 'blasts']","A fire triggered by the blasts damaged eight buildings at the plant, including one that was burned down."
Mechanical <e1>faults</e1> caused delays and <e2>cancellations</e2> on Wellington's suburban train services this morning.,0,"['faults', 'cancellations']",Mechanical faults caused delays and cancellations on Wellington's suburban train services this morning.
Relieve spinal stenosis by enlarging the spinal canal to relieve <e1>pressure</e1> on the spinal cord that has been caused by a herniated or bulging <e2>disc</e2>.,1,"['pressure', 'disc']",Relieve spinal stenosis by enlarging the spinal canal to relieve pressure on the spinal cord that has been caused by a herniated or bulging disc.
Passengers have rights in the event of a delay or <e1>cancellation</e1> that has been caused by the <e2>airline</e2>.,1,"['cancellation', 'airline']",Passengers have rights in the event of a delay or cancellation that has been caused by the airline.
However Susanoo was in <e1>sorrow</e1> after the <e2>loss</e2> of his mother and he was raging in his kingdom.,1,"['sorrow', 'loss']",However Susanoo was in sorrow after the loss of his mother and he was raging in his kingdom.
But the <e1>earthquake</e1> triggered by the <e2>eruption</e2> of Thera struck first.,1,"['earthquake', 'eruption']",But the earthquake triggered by the eruption of Thera struck first.
"<e1>Diabetes mellitus</e1> is one of the leading causes of irreversible <e2>blindness</e2> worldwide, and, in the United States.",0,"['Diabetes mellitus', 'blindness']","Diabetes mellitus is one of the leading causes of irreversible blindness worldwide, and, in the United States."
Getting help has reduced the time to reverse all the <e1>irritation</e1> that had been caused by the <e2>fungus</e2>.,1,"['irritation', 'fungus']",Getting help has reduced the time to reverse all the irritation that had been caused by the fungus.
"On the other hand, the higher the <e1>satisfaction</e1> from the <e2>purchase</e2>, the greater the benefit of word-of-mouth referrals and repeat purchasing.",1,"['satisfaction', 'purchase']","On the other hand, the higher the satisfaction from the purchase, the greater the benefit of word-of-mouth referrals and repeat purchasing."
District Judge without a jury and judgment was entered for the defendants on the ground that the <e1>accident</e1> was caused by the plaintiff's own <e2>negligence</e2>.,1,"['accident', 'negligence']",District Judge without a jury and judgment was entered for the defendants on the ground that the accident was caused by the plaintiff's own negligence.
The children descend the ladder after hearing the fire <e1>alarm</e1> which has been triggered by the wood work workshop catching <e2>fire</e2>.,1,"['alarm', 'fire']",The children descend the ladder after hearing the fire alarm which has been triggered by the wood work workshop catching fire.
The <e1>incident</e1> caused a brief <e2>sensation</e2> on the Web among people suspicious that it was a political commentary.,0,"['incident', 'sensation']",The incident caused a brief sensation on the Web among people suspicious that it was a political commentary.
"And this is frequently cited as ""proof"" that saturated fats and <e1>cholesterol</e1> cause heart <e2>disease</e2>.",0,"['cholesterol', 'disease']","And this is frequently cited as ""proof"" that saturated fats and cholesterol cause heart disease."
"Many commercial soap, shower gel or cleanser products contain <e1>preservatives</e1>, colorants and chemicals that cause dryness, rashes, <e2>itchiness</e2> and roughness on the skin.",0,"['preservatives', 'itchiness']","Many commercial soap, shower gel or cleanser products contain preservatives, colorants and chemicals that cause dryness, rashes, itchiness and roughness on the skin."
Birchwood and Stockton Heath were called to the scene after <e1>pyrotechnics</e1> used during one of the performances caused a <e2>fire</e2> on the main stage.,0,"['pyrotechnics', 'fire']",Birchwood and Stockton Heath were called to the scene after pyrotechnics used during one of the performances caused a fire on the main stage.
Like a catch-22 the worst part is that acne causes stress and <e1>stress</e1> triggers acne <e2>breakouts</e2>.,0,"['stress', 'breakouts']",Like a catch-22 the worst part is that acne causes stress and stress triggers acne breakouts.
The US patent system is in a <e1>crisis</e1> that has been caused by the <e2>flood</e2> of patent applications being filed at the USPTO every year.,1,"['crisis', 'flood']",The US patent system is in a crisis that has been caused by the flood of patent applications being filed at the USPTO every year.
Viral gastroenteritis is a highly contagious <e1>infection</e1> of the intestines caused by one of several <e2>viruses</e2>.,1,"['infection', 'viruses']",Viral gastroenteritis is a highly contagious infection of the intestines caused by one of several viruses.
Diet fizzy <e1>drinks</e1> and meat cause heart disease and <e2>diabetes</e2>.,0,"['drinks', 'diabetes']",Diet fizzy drinks and meat cause heart disease and diabetes.
"We explore the experience of <e1>grief</e1> after the <e2>loss</e2> of a parent and offers support; we also make simple suggestions, and we provide a place for sharing memories.",1,"['grief', 'loss']","We explore the experience of grief after the loss of a parent and offers support; we also make simple suggestions, and we provide a place for sharing memories."
The war <e1>mentality</e1> was generated by the Iraq <e2>war</e2> in combination with the constant drum beat of fear at home.,1,"['mentality', 'war']",The war mentality was generated by the Iraq war in combination with the constant drum beat of fear at home.
<e1>Preeclampsia</e1> is still one of the leading causes of maternal <e2>mortality</e2>.,0,"['Preeclampsia', 'mortality']",Preeclampsia is still one of the leading causes of maternal mortality.
The <e1>demolition</e1> was the cause of <e2>terror</e2> and communal divide is just a way of not letting truth prevail.,0,"['demolition', 'terror']",The demolition was the cause of terror and communal divide is just a way of not letting truth prevail.
"The <e1>outbreak</e1> resulted in 256 deaths and 3,402 <e2>injuries</e2>.",0,"['outbreak', 'injuries']","The outbreak resulted in 256 deaths and 3,402 injuries."
"Sip the tea slowly to reduce stomach <e1>pain</e1> from <e2>indigestion</e2>, bloating and feeling of fullness.",1,"['pain', 'indigestion']","Sip the tea slowly to reduce stomach pain from indigestion, bloating and feeling of fullness."
"<e1>Alcohol</e1>, substance abuse and poverty all lead to <e2>child abuse</e2>.",0,"['Alcohol', 'child abuse']","Alcohol, substance abuse and poverty all lead to child abuse."
The ATM <e1>malfunction</e1> caused a <e2>rush</e2> on the ATM machine until the police sealed off the area.,0,"['malfunction', 'rush']",The ATM malfunction caused a rush on the ATM machine until the police sealed off the area.
"<e1>Sodium</e1> causes fluid <e2>retention</e2>, which can lead to edema (swelling), increased blood pressure, and in those susceptible patients, congestive heart failure.",0,"['Sodium', 'retention']","Sodium causes fluid retention, which can lead to edema (swelling), increased blood pressure, and in those susceptible patients, congestive heart failure."
In businesses generally the third party claims for the <e1>damages</e1> that has been caused by the company <e2>vehicle</e2>.,1,"['damages', 'vehicle']",In businesses generally the third party claims for the damages that has been caused by the company vehicle.
The <e1>law</e1> established a major <e2>redistribution</e2> of territorial sovereignty within the Empire.,0,"['law', 'redistribution']",The law established a major redistribution of territorial sovereignty within the Empire.
Infectious mononucleosis due to the Epstein-Barr <e1>virus</e1> causes exudative <e2>tonsillitis</e2> or pharyngitis in about one-half of cases.,0,"['virus', 'tonsillitis']",Infectious mononucleosis due to the Epstein-Barr virus causes exudative tonsillitis or pharyngitis in about one-half of cases.
"During the trial, the prosecution presented ""pictures of burning bodies and human remains as well as images of the <e1>explosion</e1> triggered by the Pentagon <e2>crash</e2>.""",1,"['explosion', 'crash']","During the trial, the prosecution presented ""pictures of burning bodies and human remains as well as images of the explosion triggered by the Pentagon crash."""
